,Unnamed: 0,name,year,text,locality,titulaire-nom,titulaire-prenom,titulaire-soutien,titulaire-liste,suppleant-nom,suppleant-prenom,suppleant-soutien,suppleant-liste,nat,priv,locality-nom,affiliation,pcf,ps,rpr,udf,sentiment
321,322,EL137_L_1981_06_094_03_1_PF_02,1981.0, lutter contre le chomage :' 'travailler tous pour travailler moins' 'améliorer les conditions de travail' relancer l'économie sous l'impulsion d'un secteur nationalisé élargi ,,Perrot,J-C,Parti socialiste,Majorité de la France,Le Devehat,Marcelle,Parti socialiste,Majorité de la France,True,False,Val-de-Marne,left,0.0,1.0,0.0,0.0,3.0
322,323,EL134_L_1981_06_034_01_1_PF_06,1981.0, ☒ 'apaiser vos inquiétudes par :' le contrôle de la sélectivité de la croissance veiller à l'état incitatif du rôle de l'etat limiter les nationalisations etudier les incidences de l'impôt sur le revenu et successions analyser les effets du plafonnement du quotient familial protection des exploitations familiales (offices fonciers) assurer le revenu des exploitants définition d'une politique vinicole création d'un office des vins protection de notre agriculture dans l'europe assumer une meilleure répartition des charges sociales mise en place d'une politique sociale librement consentie par les partenaires sociaux rôle d'incitation de l'etat mise en place d'une politique rigoureuse pour la protection de notre littoral mer et étangs le tourisme social développer les énergies nouvelles limiter le nucléaire défendre la pluralité de l'enseignement et le respect des identités respect de la liberté d'entreprendre et de la libre entreprise soutien à l'artisanat et aux p,,Calvo,Vincent,Mouvement des radicaux de gauche,Majorité présidentielle,Strebler,Georges,Mouvement des radicaux de gauche,Majorité présidentielle,True,False,Hérault,left,0.0,0.0,0.0,0.0,2.0
323,324,EL134_L_1981_06_006_01_1_PF_04,1981.0, la nationalisation ne résoudrait rien,,Mazoutier,Michelle,Mouvement des radicaux de gauche,non mentionné,Karon,Joseph,Mouvement des radicaux de gauche,non mentionné,True,False,Alpes-Maritimes,left,0.0,0.0,0.0,0.0,1.0
324,325,EL134_L_1981_06_006_01_1_PF_04,1981.0, plus que de nationalisation c'est d'européanisation qu'il faudrait parler,,Mazoutier,Michelle,Mouvement des radicaux de gauche,non mentionné,Karon,Joseph,Mouvement des radicaux de gauche,non mentionné,True,False,Alpes-Maritimes,left,0.0,0.0,0.0,0.0,2.0
325,326,EL134_L_1981_06_008_02_1_PF_03,1981.0, 'les entreprises :' 'la nationalisation du crédit et des onze plus grandes sociétés françaises qui représentent 30 % de nos exportations' le doublement de l'imposition forfaitaire le droit de vote au comité d'entreprise en matière d'embauche et d'investissement,,Zeller,Emmanuel,Union pour la démocratie française,Union pour une nouvelle majorité,Girard,Thérèse,Union pour la démocratie française,Union pour une nouvelle majorité,True,False,Ardennes,right,0.0,0.0,0.0,1.0,1.0
326,327,EL137_L_1981_06_076_03_1_PF_05,1981.0,' nouvelle planification pour relancer l'investissement défense du franc nationalisation des 9 groupes industriels prévus,,Bourguignon,Pierre,Parti socialiste;Mouvement des radicaux de gauche,non mentionné,Valognes,Rolande,Parti socialiste;Mouvement des radicaux de gauche,non mentionné,True,False,Seine-Maritime,left,0.0,1.0,0.0,0.0,3.0
327,328,EL135_L_1981_06_046_02_1_PF_01,1981.0, les nationalisations proposées par le président de la république sont une première étape,,Stephant,Yannick,Parti communiste français,Majorité d'union de la gauche,Gras,Jean-Claude,Parti communiste français,Majorité d'union de la gauche,True,False,Lot,far-left,1.0,0.0,0.0,0.0,3.0
328,329,EL135_L_1981_06_046_02_1_PF_01,1981.0, les grandes sociétés pétrolières et les trusts industriels doivent être nationalisés,,Stephant,Yannick,Parti communiste français,Majorité d'union de la gauche,Gras,Jean-Claude,Parti communiste français,Majorité d'union de la gauche,True,False,Lot,far-left,1.0,0.0,0.0,0.0,3.0
329,330,EL134_L_1981_06_024_01_1_PF_01,1981.0, 'la nationalisation démocratique du secteur bancaire et financier du crédit des principaux groupes industriels est une condition du renouveau,,Gorse,Roger,Parti communiste français,non mentionné,Leduff,Maurice,Parti communiste français,non mentionné,True,False,Dordogne,far-left,1.0,0.0,0.0,0.0,3.0
330,331,EL134_L_1981_06_024_01_1_PF_01,1981.0, il faut démocratiser le secteur nationalisé existant,,Gorse,Roger,Parti communiste français,non mentionné,Leduff,Maurice,Parti communiste français,non mentionné,True,False,Dordogne,far-left,1.0,0.0,0.0,0.0,2.0
331,332,EL135_L_1981_06_059_20_1_PF_03,1981.0,' les dirigeants socialistes ont également décidé s'ils emportaient ces élections de nationaliser les écoles privées par étapes,,Huart,Julien,Rassemblement pour la République;Union pour la démocratie française,Union pour une nouvelle majorité,Pavy,Paul,non mentionné,Union pour une nouvelle majorité,True,False,Nord,right,0.0,0.0,1.0,1.0,3.0
332,333,EL134_L_1981_06_029_01_1_PF_02,1981.0,' 'en nationalisant les grandes affaires et les banques sous contrôle ouvrier mais aussi en promouvant la socialisation de certains moyens de production au niveau des régions des pays des communes ,,Guillou,Henri,Parti socialiste unifié;Union démocratique bretonne,Pour l'autogestion,Le Rhun,Guy,Parti socialiste unifié;Union démocratique bretonne,Pour l'autogestion,True,False,Finistère,left,0.0,1.0,0.0,0.0,3.0
333,334,EL137_L_1981_06_093_03_1_PF_05,1981.0, nationalisations main-mise de l'etat sur l'ensemble de l'economie interventions de l'etat dans votre vie courante libre choix de l'enseignement pensons aux ecoles libres médecine de votre choix loisirs et culture ,,Mignot,Louis,non mentionné,Union pour une nouvelle majorité,Parisot,Thérèse,non mentionné,Union pour une nouvelle majorité,True,False,Seine-Saint-Denis,unaffiliated,0.0,0.0,0.0,0.0,1.0
334,335,EL134_L_1981_06_018_03_1_PF_06,1981.0, nous refusons les illusions et les dangers d'une société étatisée que l'on veut nous imposer,,Caldi,Pierre,aucun parti politique,non mentionné,Perrot,Bernadette,aucun parti politique,non mentionné,True,False,Cher,unaffiliated,0.0,0.0,0.0,0.0,1.0
335,336,EL135_L_1981_06_054_06_1_PF_03,1981.0,' maîtrise de l'économie par le renforcement du secteur public obtenu en nationalisant neuf grands groupes industriels le secteur bancaire la sidérurgie et les mines de fer,,Tonin,Jérôme,Parti socialiste,non mentionné,Lagravière,Roger,Parti socialiste,non mentionné,True,False,Meurthe-et-Moselle,left,0.0,1.0,0.0,0.0,3.0
336,337,EL137_L_1981_06_092_12_1_PF_08,1981.0, cela ne peut se faire avec des recettes qui ont échoué partout comme les nationalisations l'étatisation la bureaucratisation de notre économie et de notre société,,Masson,Roland,non mentionné,non mentionné,Lottin,Patrick,non mentionné,non mentionné,True,False,Hauts-de-Seine,unaffiliated,0.0,0.0,0.0,0.0,1.0
337,338,EL134_L_1981_06_006_06_1_PF_01,1981.0, certaines entreprises sont nationalisables : le contenu dépendra des travailleurs : simple étatisation au autre chose ,,Dubois,Anne-Marie,Parti socialiste unifié,non mentionné,Pages,Irène,Parti socialiste unifié,non mentionné,True,False,Alpes-Maritimes,left,0.0,1.0,0.0,0.0,2.0
338,339,EL135_L_1981_06_057_04_1_PF_02,1981.0, c'est en effet aux ministres communistes du gouvernement de la libération que l'on doit de grandes réformes sociales et économiques telles que la sécurité sociale le statut de la fonction publique les comités d'entreprise la nationalisation de certaines banques et compagnies d'assurances de renault etc,,Matteis,René de,communiste,Majorité d'union de la gauche,Souffrin,Paul,non mentionné,non mentionné,True,False,Moselle,far-left,0.0,0.0,0.0,0.0,3.0
339,340,EL135_L_1981_06_057_01_1_PF_06,1981.0, nationaliser la sidérurgie c'est indispensable mais pour la placer sous le contrôle direct des travailleurs,,Mercier,Michel,Parti socialiste unifié,Alternative 81,Hoffmann,Suzanne,Parti socialiste unifié,Alternative 81,True,False,Moselle,left,0.0,1.0,0.0,0.0,3.0
340,341,EL136_L_1981_06_075_08_1_PF_06,1981.0, cette perspective peut être entamée aujourd'hui à travers les nationalisations prévues dans le programme de françois mitterrand,,Morvan,François,Comités communistes pour l'autogestion,non mentionné,Lalande,Martine,Comités communistes pour l'autogestion,non mentionné,True,False,Paris,far-left,0.0,0.0,0.0,0.0,3.0
341,342,EL136_L_1981_06_075_08_1_PF_06,1981.0, mais pour cela il faut donner dans les entreprises nationalisées le pouvoir aux travailleurs et non à des conseils d'administration désignés par l'état,,Morvan,François,Comités communistes pour l'autogestion,non mentionné,Lalande,Martine,Comités communistes pour l'autogestion,non mentionné,True,False,Paris,far-left,0.0,0.0,0.0,0.0,3.0
342,343,EL136_L_1981_06_075_08_1_PF_06,1981.0, enfin est-il envisageable de limiter d'emblée les nationalisations à une poignée de trusts,,Morvan,François,Comités communistes pour l'autogestion,non mentionné,Lalande,Martine,Comités communistes pour l'autogestion,non mentionné,True,False,Paris,far-left,0.0,0.0,0.0,0.0,2.0
343,344,EL134_L_1981_06_024_03_2_PF_02,1981.0,' voilà un pouvoir absolu qui détiendrait entre ses mains et sans contrepoids l'essentiel des pouvoirs de l'etat : 'présidence de la république gouvernement assemblée nationale syndicats banques industries nationalisées administrations et écoles,,Beylot,Pierre,non mentionné,Union pour une nouvelle majorité,Faure,Alain,non mentionné,Union pour une nouvelle majorité,True,False,Dordogne,unaffiliated,0.0,0.0,0.0,0.0,2.0
344,345,EL134_L_1981_06_025_02_1_PF_03,1981.0, 'dans la circonscription de montbéliard :' nous demandons la nationalisation sous contrôle des travailleurs du groupe peugeot : qui doit son développement aux profits réalisés sur le travail de générations d'ouvriers qui étend son emprise sur l'emploi le logement le commerce la sous-traitance dans toute la région,,Minazzi,Georges,Parti socialiste unifié,non mentionné,Chère,Ginette,Parti socialiste unifié,non mentionné,True,False,Doubs,left,0.0,1.0,0.0,0.0,1.0
345,346,EL134_L_1981_06_025_02_1_PF_03,1981.0, les entreprises nationalisées sous contrôle ouvrier doivent servir de base à une nouvelle politique économique et sociale créatrice d'emplois (droits étendus pour les salariés droits à l'emploi pour tous conseils d'atelier resserrement de la hiérarchie par le relèvement des bas salaires les 35 heures ,,Minazzi,Georges,Parti socialiste unifié,non mentionné,Chère,Ginette,Parti socialiste unifié,non mentionné,True,False,Doubs,left,0.0,1.0,0.0,0.0,3.0
346,347,EL137_L_1981_06_078_01_1_PF_01,1981.0, cette perspective peut être entamée aujourd'hui à travers les nationalisations prévues dans le programme de françois mitterrand,,Lecomte,Pierre,Comités communistes pour l'autogestion,non mentionné,Duveau,Paule,Comités communistes pour l'autogestion,non mentionné,True,False,Yvelines,far-left,0.0,0.0,0.0,0.0,3.0
347,348,EL137_L_1981_06_078_01_1_PF_01,1981.0, mais pour cela il faut donner dans les entreprises nationalisées le pouvoir aux travailleurs et non à des conseils d'administration désignés par l'état,,Lecomte,Pierre,Comités communistes pour l'autogestion,non mentionné,Duveau,Paule,Comités communistes pour l'autogestion,non mentionné,True,False,Yvelines,far-left,0.0,0.0,0.0,0.0,3.0
348,349,EL137_L_1981_06_078_01_1_PF_01,1981.0, enfin est-il envisageable de limiter d'emblée les nationalisations à une poignée de trusts ,,Lecomte,Pierre,Comités communistes pour l'autogestion,non mentionné,Duveau,Paule,Comités communistes pour l'autogestion,non mentionné,True,False,Yvelines,far-left,0.0,0.0,0.0,0.0,2.0
349,350,EL136_L_1981_06_075_14_1_PF_06,1981.0, contre la pouvoir patronal pour le contrôle des travailleurs sur la marche des entreprises et les nationalisations,,Boislaroussie,Jean-Jacques,Parti socialiste unifié,non mentionné,Metra,Pierrette,Parti socialiste unifié,non mentionné,True,False,Paris,left,0.0,1.0,0.0,0.0,3.0
350,351,EL136_L_1981_06_075_28_1_PF_03,1981.0,' les radicaux de gauche ne veulent pas d'une étatisation bureaucratique ni que soit remise en cause l'existense du secteur privé dont ils avaient fait alors admettre à leurs partenaires qu'il était nécessaire à la santé économique du pays,,Mattei,Pierre,Mouvement des radicaux de gauche,non mentionné,Nonclercq,Georges,Mouvement des radicaux de gauche,non mentionné,True,False,Paris,left,0.0,0.0,0.0,0.0,2.0
351,352,EL137_L_1981_06_095_01_1_PF_06,1981.0, 'pourquoi y avoir mis jobert gaulliste ancien ministre de pompidou et des radicaux soi-disant « de gauche » comme faure et crépeau qui sont des adversaires acharnés des nationalisations ,,Domart,Patrick,Ligue communiste révolutionnaire,non mentionné,Deltell,Marcel,Ligue communiste révolutionnaire,non mentionné,True,False,Val-d'Oise,far-left,0.0,0.0,0.0,0.0,1.0
352,353,EL137_L_1981_06_095_01_1_PF_06,1981.0, '' les travailleurs doivent être vigilants : tenir les patrons à l'œil contrôler tout ce qu'ils font pour déjouer leurs mauvais coups ; et s'ils sabotent le changement qu'on les nationalise sans leur donner un sou ,,Domart,Patrick,Ligue communiste révolutionnaire,non mentionné,Deltell,Marcel,Ligue communiste révolutionnaire,non mentionné,True,False,Val-d'Oise,far-left,0.0,0.0,0.0,0.0,3.0
353,354,EL135_L_1981_06_041_03_2_PF_01,1981.0, mais nous refusons les contraintes d'une étatisation qui nous priverait d'une grande partie de nos liber- tés à commencer par la liberté d'expression qui a été menacée dès le premier soir des législatives par le ministre de l'intérieur lui-même,,Desanlis,Jean,non mentionné,Union pour une nouvelle majorité,Peltier,Bernard,non mentionné,Union pour une nouvelle majorité,True,False,Loir-et-Cher,unaffiliated,0.0,0.0,0.0,0.0,1.0
354,355,EL136_L_1981_06_075_17_1_PF_05,1981.0,' malgré l'ambiguïté entretenue par le pouvoir jusqu'aux élections chacun sent bien que le pire encore à venir nous est soigneusement caché : l'entrée de ministres communistes au gouvernement l'augmentation massive de la pression fiscale et des charges sociales la nationalisation de l'enseignement libre l'étatisation du crédit la bureaucratisation générale de l'économie,,Marette,Jacques,Rassemblement pour la République;Union pour la démocratie française,Union pour une nouvelle majorité,Rocher,Bernard,Rassemblement pour la République;Union pour la démocratie française,Union pour une nouvelle majorité,True,False,Paris,right,0.0,0.0,1.0,1.0,1.0
355,356,EL134_L_1981_06_013_02_1_PF_06,1981.0, édition « club socialiste du livre») la nationalisation de l'économie et du crédit (page 221) la disparition de l'enseignement libre (page 284) l'arrêt du programme énergétique l'étouffement de la médecine libérale ces mesures conduiront rapidement la france à la faillite aussi bien dans le domaine de l'inflation que dans celui du chômage ou dans celui de l'indépendance énergétique,,Gaudin,Jean-Claude,Union pour la démocratie française;Rassemblement pour la République,Union pour une nouvelle majorité,Roatta,Jean,Union pour la démocratie française;Rassemblement pour la République,Union pour une nouvelle majorité,True,False,Bouches-du-Rhône,right,0.0,0.0,1.0,1.0,1.0
356,357,EL137_L_1981_06_094_05_1_PF_02,1981.0, en nationalisant le crédit et les banques' ',,Beaumont,Jean-Louis,Rassemblement pour la République;Union pour la démocratie française;Centre national des indépendants;Centre des démocrates sociaux;Parti républicain;Parti radical;Mouvement pour le socialisme par la participation;Union gaulliste pour la démocratie;Union des libéraux indépendants,Union pour une nouvelle majorité,Moscara,Bastien,Rassemblement pour la République;Union pour la démocratie française;Centre national des indépendants;Centre des démocrates sociaux;Parti républicain;Parti radical;Mouvement pour le socialisme par la participation;Union gaulliste pour la démocratie;Union des libéraux indépendants,Union pour une nouvelle majorité,True,False,Val-de-Marne,right,0.0,0.0,1.0,1.0,3.0
357,358,EL137_L_1981_06_094_05_1_PF_02,1981.0, en nationalisant les groupes industriels les plus performants' ',,Beaumont,Jean-Louis,Rassemblement pour la République;Union pour la démocratie française;Centre national des indépendants;Centre des démocrates sociaux;Parti républicain;Parti radical;Mouvement pour le socialisme par la participation;Union gaulliste pour la démocratie;Union des libéraux indépendants,Union pour une nouvelle majorité,Moscara,Bastien,Rassemblement pour la République;Union pour la démocratie française;Centre national des indépendants;Centre des démocrates sociaux;Parti républicain;Parti radical;Mouvement pour le socialisme par la participation;Union gaulliste pour la démocratie;Union des libéraux indépendants,Union pour une nouvelle majorité,True,False,Val-de-Marne,right,0.0,0.0,1.0,1.0,1.0
358,359,EL137_L_1981_06_094_05_1_PF_02,1981.0, en nationalisant et en socialisant la france,,Beaumont,Jean-Louis,Rassemblement pour la République;Union pour la démocratie française;Centre national des indépendants;Centre des démocrates sociaux;Parti républicain;Parti radical;Mouvement pour le socialisme par la participation;Union gaulliste pour la démocratie;Union des libéraux indépendants,Union pour une nouvelle majorité,Moscara,Bastien,Rassemblement pour la République;Union pour la démocratie française;Centre national des indépendants;Centre des démocrates sociaux;Parti républicain;Parti radical;Mouvement pour le socialisme par la participation;Union gaulliste pour la démocratie;Union des libéraux indépendants,Union pour une nouvelle majorité,True,False,Val-de-Marne,right,0.0,0.0,1.0,1.0,3.0
359,360,EL137_L_1981_06_090_01_1_PF_04,1981.0, les entreprises nationalisées dans la région : alsthom bull (peugeot devrait aussi l'être) pourront réellement servir de point de départ à une nouvelle politique économique et sociale pour qu'elle s'étende à tous les salariés,,Lugand,Colette,Parti socialiste unifié,Alternative 81,Bouvier,Yves,Parti socialiste unifié,Alternative 81,True,False,Territoire-de-Belfort,left,0.0,1.0,0.0,0.0,3.0
360,361,EL134_L_1981_06_006_02_1_PF_01,1981.0, pour prendre des mesures anticapitalistes ouvrant la voie au socialisme et à l'autogestion : il faut ☒ donner dans les entreprises nationalisées le pouvoir aux travailleurs et non à des conseils d'administration désignés par l'etat comme à l'edf aux ptt et à la sncf qui sont restées des entreprises où les travailleurs n'ont aucun pouvoir réel,,Giani,Guy,non mentionné,non mentionné,Aulnette,Camille,non mentionné,non mentionné,True,False,Alpes-Maritimes,unaffiliated,0.0,0.0,0.0,0.0,3.0
361,362,EL135_L_1981_06_059_03_2_PF_02,1981.0, mais il faut une autre politique économique par la relance du pouvoir d'achat des travailleurs et une intervention du plan qui grâce à la nationalisation du système financier et des grands groupes industriels gardera dans chaque région les investissements indispensables,,Osselin,Jacqueline,Parti socialiste,non mentionné,Masset,Bernard,Parti socialiste,non mentionné,True,False,Nord,left,0.0,1.0,0.0,0.0,3.0
362,363,EL136_L_1981_06_069_02_1_PF_03,1981.0, 'il faut un socialisme autogestionnaire et ecologique pour un socialisme autogestionnaire nous voulons' la nationalisation sous le contrôle des travailleurs des entreprises clés pour enlever aux puissances d'argent le moyen de dominer l'économie dans les entreprises des conseils d'ateliers et de bureaux responsables des conditions et de l'organisation du travail comme de l'activité de l'entreprise (ouverture des livres de comptes élections des directions) 'dans les quartiers les moyens de contrôler notre cadre de vie (logement environnement pollution santé)' 'pour un socialisme ecologique nous voulons :' une école ouverte sur la vie dans un service public d'education associant enseignants enseignés et parents à sa gestion et permettant l'épanouissement de tous,,Fuchs,Jacques,Parti socialiste unifié,non mentionné,Thenoz,Michel,Parti socialiste unifié,non mentionné,True,False,Rhône,left,0.0,1.0,0.0,0.0,3.0
363,364,EL136_L_1981_06_069_05_1_PF_03,1981.0, si nous succombions à la tentation de travailler moins d'alourdir les charges qui pèsent sur nos entreprises d'étendre exagérément par les nationalisations un secteur public dont les méthodes sont inadaptées au grand défi de la concurrence internationale nous glisserions peu à peu vers la facilité le relâchement et l'échec,,Cousté,Pierre-Bernard,Union pour la démocratie française;Rassemblement pour la République,Union pour une nouvelle majorité,André,Simone,Union pour la démocratie française;Rassemblement pour la République,Union pour une nouvelle majorité,True,False,Rhône,right,0.0,0.0,1.0,1.0,1.0
364,365,EL134_L_1981_06_006_03_1_PF_03,1981.0, seule une assemblée à majorité de gauche peut réaliser les nationalisations nécessaires tout en assurant la juste indemnisation des petits épargnants,,Colonna,Jean-Hugues,Parti socialiste,non mentionné,Robin,Gilbert,Parti socialiste,non mentionné,True,False,Alpes-Maritimes,left,0.0,1.0,0.0,0.0,3.0
365,366,EL134_L_1981_06_007_01_1_PF_03,1981.0, ibe 07400 le teil' 'pour la france' 'oui au changement de politique non au changement de société' oui à une agriculture en expansion où l'outil de travail sera protégé non aux offices fonciers et à la collectivisation de la terre oui à la défense des institutions de notre pays non à la bureaucratie socialiste oui à la liberté d'entreprendre non à la collectivisation et aux nationalisations oui à la liberté de l'enseignement non à la laïcité totale oui à un système libéral de santé non à la fonctionnarisation de la médecine oui à la famille non à l'éclatement de la structure familiale oui à la diminution des impôts non aux dépenses excessives de l'etat 'oui à la solidarité avec les personnes âgées non à la spoliation des petits épargnants' 'oui à la relance de la production non à la taxe professionnelle,,Chirouze,Jean-Louis,non mentionné,non mentionné,Mathon,Aimé,non mentionné,non mentionné,True,False,Ardèche,unaffiliated,0.0,0.0,0.0,0.0,1.0
366,367,EL134_L_1981_06_035_04_1_PF_03,1981.0,' 'il est maintenant possible de mieux maitriser notre économie en nationalisant les banques et les neuf groupes industriels français dominants pour' 'reconquérir notre marché intérieur' 'libérer les p,,Bourges,Pierre,Parti socialiste,non mentionné,Amossé,Gilbert,Parti socialiste,non mentionné,True,False,Ille-et-Vilaine,left,0.0,1.0,0.0,0.0,3.0
367,368,EL135_L_1981_06_059_02_1_PF_06,1981.0, de refuser les nationalisations car elles n'apporteront rien de mieux au pays imaginez-vous par exemple ce que seraient vos relations avec votre banquier si demain ses guichets devenaient des guichets genre sécurité sociale ,,Payelle,Michèle,Action républicaine indépendante et libérale,Union pour une nouvelle majorité parlementaire,Bocquet,Jean-Claude,Action républicaine indépendante et libérale,Union pour une nouvelle majorité parlementaire,True,False,Nord,unaffiliated,0.0,0.0,0.0,0.0,1.0
368,369,EL137_L_1981_06_084_01_1_PF_01,1981.0,' le secteur bancaire et financier le crédit ainsi que les principaux groupes industriels seront nationalisés,,Bertrand,Jacques,Parti communiste français,Majorité d'union de la gauche,Isard,Alain,Parti communiste français,Majorité d'union de la gauche,True,False,Vaucluse,far-left,1.0,0.0,0.0,0.0,3.0
369,370,EL137_L_1981_06_092_11_1_PF_06,1981.0, 'pourquoi y avoir mis jobert gaulliste ancien ministre de pompidou et des radicaux soi-disant « de gauche » comme faure et crépeau qui sont des adversaires acharnés des nationalisations ,,Dupuy,Emmanuelle,Ligue communiste révolutionnaire,non mentionné,Lafferriere,Jean,Ligue communiste révolutionnaire,non mentionné,True,False,Hauts-de-Seine,far-left,0.0,0.0,0.0,0.0,1.0
370,371,EL137_L_1981_06_092_11_1_PF_06,1981.0, '' les travailleurs doivent être vigilants : tenir les patrons à l'œil contrôler tout ce qu'ils font pour déjouer leurs mauvais coups ; et s'ils sabotent le changement qu'on les nationalise sans leur donner un sou ,,Dupuy,Emmanuelle,Ligue communiste révolutionnaire,non mentionné,Lafferriere,Jean,Ligue communiste révolutionnaire,non mentionné,True,False,Hauts-de-Seine,far-left,0.0,0.0,0.0,0.0,3.0
371,372,EL134_L_1981_06_013_08_1_PF_01,1981.0, pour la désétatisation de l'économie,,Pantaleo,Guy,Front national,non mentionné,Lebeault,Pierre,Front national,non mentionné,False,True,Bouches-du-Rhône,far-right,0.0,0.0,0.0,0.0,3.0
372,373,EL137_L_1981_06_090_01_1_PF_06,1981.0, ) pour des nationalisations des entreprises qui ne respecteraient pas les exigences populaires mais sans rachat ni indemnités pour les gros actionnaires sous le contrôle actif des travailleurs,,Grevillot,Jean-Marie,non mentionné,non mentionné,Nieps,Michèle,non mentionné,non mentionné,True,False,Territoire-de-Belfort,unaffiliated,0.0,0.0,0.0,0.0,3.0
373,374,EL136_L_1981_06_074_02_1_PF_03,1981.0, extension du secteur nationalisé à onze groupes industriels' ',,Frossard,Michel,Parti socialiste,non mentionné,Pruvost,François,Parti socialiste,non mentionné,True,False,Haute-Savoie,left,0.0,1.0,0.0,0.0,3.0
