,Unnamed: 0,name,year,text,locality,titulaire-nom,titulaire-prenom,titulaire-soutien,titulaire-liste,suppleant-nom,suppleant-prenom,suppleant-soutien,suppleant-liste,nat,priv,locality-nom,affiliation,pcf,ps,rpr,udf,sentiment
621,622,EL177_L_1988_06_075_11_1_PF_01,1988.0, l'augmentation des effectifs notamment dans les hôpitaux et les ptt et le retour au public des secteurs privatisés au profit du patronat (nettoyage eau potable ,,Penit,Jacqueline,Comités d'initiative pour une nouvelle politique à gauche,Initiative pour une nouvelle politique à gauche,Negroni,Bruno,Comités d'initiative pour une nouvelle politique à gauche,Initiative pour une nouvelle politique à gauche,False,True,Paris,left,0.0,0.0,0.0,0.0,1.0
622,623,EL174_L_1988_06_023_02_1_PF_01,1988.0, 'pour les services publics les coupes sombres et la privatisation,,Debesson,René,Parti communiste français,Rassemblement des forces de gauche,Grenier,Jean-Claude,Parti communiste français,Rassemblement des forces de gauche,False,True,Creuse,far-left,1.0,0.0,0.0,0.0,1.0
623,624,EL177_L_1988_06_092_07_1_PF_01,1988.0, créer des emplois ☒' relance de la production en favorisant l'investissement productif création d'emplois en produisant en france et en coopérant avec les autres peuples 'transformation des emplois précaires en emplois stables' 'renationalisation des entreprises récemment privatisées' ,,Pacouret,Jean-Raymond,Parti communiste français,Rassemblement des forces de gauche,Lachal,Marc,Parti communiste français,Rassemblement des forces de gauche,False,True,Hauts-de-Seine,far-left,1.0,0.0,0.0,0.0,3.0
624,625,EL174_L_1988_06_010_03_1_PF_05,1988.0, 'cette politique doit être poursuivie ; pour cela il faut :' 'stopper les privatisations' 'rendre tf1 au service public' 'faire appliquer les lois auroux' 'surtaxer les plus-values boursières' 'mettre en place un grand service scolaire public et laïque' 'faire payer les grosses fortunes,,Croizier,Gérard,socialistes,non mentionné,Gruyer,Josette,socialistes,non mentionné,False,True,Aube,left,0.0,0.0,0.0,0.0,1.0
625,626,EL176_L_1988_06_072_01_1_PF_03,1988.0, 'pour mettre un frein au chômage il est' possible de créer des emplois en produisant français en arrêtant de brader nos entreprises à l'étranger en soutenant le secteur public et nationalisé,,Combe,Martin,Parti communiste français,Rassemblement des forces de gauche,Totee,Bernard,Parti communiste français,Rassemblement des forces de gauche,True,False,Sarthe,far-left,1.0,0.0,0.0,0.0,3.0
626,627,EL177_L_1988_06_076_04_1_PF_01,1988.0, surtout dans le secteur nationalisé il faut arracher les usines des mains de la direction capitaliste et les transformer en bastions de contrôle ouvrier de la production,,Cazin,Gilles,Ligue trotskyste,non mentionné,non mentionné,non mentionné,non mentionné,non mentionné,True,False,Seine-Maritime,far-left,0.0,0.0,0.0,0.0,1.0
627,628,EL176_L_1988_06_065_01_1_PF_02,1988.0, est-il nécessaire de souligner les premiers résultats de l'action courageuse entreprise par le gouvernement dès sa prise de responsabilité : stabilisation du chômage relance de l'activité économique privatisation de la plupart des grands groupes industriels livrés au culte idéologique des nationalisations réduction sensible du déficit budgétaire relance des investissements productifs lutte tenace et efficace contre l'insécurité,,Bleuler,Pierre,Union pour la démocratie française;Rassemblement pour la République,Union du rassemblement et du centre,Castells,Roland,Union pour la démocratie française;Rassemblement pour la République,Union du rassemblement et du centre,True,True,Hautes-Pyrénées,right,0.0,0.0,1.0,1.0,3.0
628,629,EL175_L_1988_06_038_02_1_PF_01,1988.0,' 'défendre le secteur public et nationalisé,,Giard,Jean,Parti communiste français,Rassemblement des forces de gauche,Biessy,Gilbert,Parti communiste français,Rassemblement des forces de gauche,True,False,Isère,far-left,1.0,0.0,0.0,0.0,3.0
629,630,EL175_L_1988_06_031_01_1_PF_05,1988.0, 'une politique du logement et de réhabilitation du centre ville qui renforce encore les effets désastreux de la loi méhaignerie;' 'une politique de privatisation des services de la mairie (parking secteur culturel et bientôt métro ,,Levade,Colette,Comités d'initiative pour une nouvelle politique à gauche,Initiative pour une nouvelle politique à gauche,Boyer,Pierre,Comités d'initiative pour une nouvelle politique à gauche,Initiative pour une nouvelle politique à gauche,False,True,Haute-Garonne,left,0.0,0.0,0.0,0.0,1.0
630,631,EL175_L_1988_06_031_01_1_PF_05,1988.0,' contre l'austérité 'le smic à 6000 francs et un revenu équivalent pour les sans-travail' 35 h sans diminution de salaire contre le chômage à l'image des travailleurs de toute l'europe qui se battent pour une réduction massive du temps de travail 'le refus des licenciements' 'le respect du droit au travail et à une formation qualifiante' 'le développement de la protection sociale contre toutes les politiques de privatisation,,Levade,Colette,Comités d'initiative pour une nouvelle politique à gauche,Initiative pour une nouvelle politique à gauche,Boyer,Pierre,Comités d'initiative pour une nouvelle politique à gauche,Initiative pour une nouvelle politique à gauche,False,True,Haute-Garonne,left,0.0,0.0,0.0,0.0,1.0
631,632,EL177_L_1988_06_091_09_1_PF_02,1988.0, ☐ ☐ ☐' 'majorité présidentielle pour la france unie' 'ce que nous ferons :' davantage de crédits pour l'éducation nationale et la recherche scientifique ; formation permanente : un crédit-formation de 1 à 2 ans pour les jeunes salariés qui auront besoin d'une qualification supplémentaire ; revenu minimum pour les plus démunis financé par l'impôt sur les grandes fortunes qui touchera les 100 000 personnes les plus riches ; 'sécurité sociale maintenue face à la maladie et à la vieillesse ;' des relations sociales modernes dans l'entreprise où les salariés auront le droit à l'information et à la concertation où l'égalité hommes-femmes sera améliorée où tous profiteront des progrès de l'économie ; 'respect des droits des immigrés en situation régulière ;' 'des rapports propriétaires-locataires plus clairs et plus équilibrés pour permettre à tous de se loger ;' soutien aux familles et à l'éducation des enfants ; arrêt des privatisations ; action déterminée pour la baisse des taux d'intérêts et pour encourager l'investissement ; protection renforcée de l'environnement des droits des associations de la liberté de l'information ; 'soutien à la création culturelle en particulier dans le domaine de la télévision ;' avancée déterminée vers l'europe seule apte à soutenir la concurrence mondiale et à garantir notre indépendance et notre niveau de vie,,Mandon,Thierry,non mentionné,Majorité présidentielle pour la France unie,Messina,Richard,non mentionné,Majorité présidentielle pour la France unie,False,True,Essonne,unaffiliated,0.0,0.0,0.0,0.0,3.0
632,633,EL176_L_1988_06_063_02_1_PF_03,1988.0, 'cette préparation passe par :' une aide accrue à l'investissement des entreprises la poursuite de la privatisation des entreprises publiques dont les recettes seront intégralement affectées à l'education et à la formation 'la baisse de la t,,Cartaud,Michel,non mentionné,Union du rassemblement et du centre,Tarrerias,Hubert,non mentionné,Union du rassemblement et du centre,False,True,Puy-de-Dôme,unaffiliated,0.0,0.0,0.0,0.0,3.0
633,634,EL175_L_1988_06_046_02_1_PF_03,1988.0, ni la nationalisation des entreprises' ',,Chastagnol,Alain,non mentionné,Union du rassemblement et du centre,Bories,Robert,non mentionné,Union du rassemblement et du centre,True,False,Lot,unaffiliated,0.0,0.0,0.0,0.0,1.0
634,635,EL177_L_1988_06_083_01_1_PF_01,1988.0, 'la détermination' dans une cohabitation difficile la majorité parlementaire a prouvé qu'elle savait choisir ses orientations et s'y maintenir : les privatisations la stabilisation en chiffres du chômage la lutte contre le terrorisme et l'insécurité la réforme de l'audiovisuel les mesures en faveur des rapatriés en sont des exemples parmi d'autres,,Colin,Daniel,Rassemblement pour la République;Union pour la démocratie française,Union du rassemblement et du centre,Bayle,Marcel,Rassemblement pour la République;Union pour la démocratie française,Union du rassemblement et du centre,False,True,Var,right,0.0,0.0,1.0,1.0,3.0
635,636,EL177_L_1988_06_075_10_1_PF_04,1988.0, 10°) je m'engage si la sécurité sociale vient à être dénationalisée comme t f 1 et cédée aux compagnies d'assurances privées à compenser la dépense du salarié pour l'assurance personalisée par une augmentation de salaire de 8% indépendamment des augmentations légales,,Tigani,François,non mentionné,Transformation à grande vitesse de l'économie française,non mentionné,non mentionné,non mentionné,Transformation à grande vitesse de l'économie française,False,True,Paris,unaffiliated,0.0,0.0,0.0,0.0,1.0
636,637,EL177_L_1988_06_080_04_1_PF_04,1988.0, - mon adversaire a soutenu l'augmentation des quotas et la privatisation du crédit agricole 'suppleant' celui qui à mes côtés par sa suppléance se présente à vos suffrages représente à la fois par sa profession de peintre le tissu artisanal local en qualité de maire de canaples la vie rurale et par ses fonctions de conseiller général de domart en ponthieu l'exemple d'une résolution sans failles à défendre l'emploi dans la vallée de la nièvre,,Becq,Jacques,non mentionné,Majorité présidentielle pour la France unie,Temmermann,Gilbert,non mentionné,Majorité présidentielle pour la France unie,False,True,Somme,unaffiliated,0.0,0.0,0.0,0.0,1.0
637,638,EL177_L_1988_06_078_05_1_PF_03,1988.0,' 'mère de deux enfants' '' 'nos objectifs de lutte et de rassemblement le programme du candidat défense du secteur public et nationalisé,,Chretienne,Auguste,Parti communiste français,Rassemblement des forces de gauche,Thierce,Josette,Parti communiste français,Rassemblement des forces de gauche,True,False,Yvelines,far-left,1.0,0.0,0.0,0.0,3.0
638,639,EL175_L_1988_06_042_01_1_PF_03,1988.0, on a eu beaucoup de privatisations mais aussi des privations : sécurité sociale : vignettes bleues médicaments de confort etc,,Salichon,Jean-Denis,non mentionné,non mentionné,Therme,Robert,non mentionné,non mentionné,False,True,Loire,unaffiliated,0.0,0.0,0.0,0.0,1.0
639,640,EL174_L_1988_06_008_03_1_PF_02,1988.0, la france a été mal défendue :' 'sa monnaie a subi 3 dévaluations' 'son économie a été bouleversée par des nationalisations sectaires' la liberté d'expression a été menacée à l'école et dans les médias 'les niveaux de vie se sont abaissés' 'les agriculteurs ont été sacrifiés,,Sourdille,Jacques,non mentionné,Union du rassemblement et du centre,Charlot,Alain,non mentionné,Union du rassemblement et du centre,True,False,Ardennes,unaffiliated,0.0,0.0,0.0,0.0,1.0
640,641,EL177_L_1988_06_075_15_1_PF_04,1988.0, 10°) je m'engage si la sécurité sociale vient à être dénationalisée comme t f 1 et cédée aux compagnies d'assurances privées à compenser la dépense du salarié pour l'assurance personalisée par une augmentation de salaire de 8% indépendamment des augmentations légales,,Campion,Nicole,non mentionné,Transformation à grande vitesse de l'économie française,non mentionné,non mentionné,non mentionné,non mentionné,False,True,Paris,unaffiliated,0.0,0.0,0.0,0.0,1.0
641,642,EL191_L_1993_03_038_01_1_PF_05,1993.0, 'la droite cherche à tirer profit de cette situation pour revenir au pouvoir et vider de leur contenu progressiste voire supprimer : sécurité sociale retraite services publics secteur nationalisé garanties collectives statuts droits sociaux école publique,,Voir,Patrice,Parti communiste français,non mentionné,Vannier,Michel,Parti communiste français,non mentionné,True,False,Isère,far-left,1.0,0.0,0.0,0.0,1.0
642,643,EL191_L_1993_03_038_01_1_PF_05,1993.0, pour mieux répondre aux besoins des populations et du pays les services publics et nationalisés devraient pouvoir assurer et élargir leur mission par la création d'emplois (e,,Voir,Patrice,Parti communiste français,non mentionné,Vannier,Michel,Parti communiste français,non mentionné,True,False,Isère,far-left,1.0,0.0,0.0,0.0,3.0
643,644,EL195_L_1993_03_075_03_1_PF_03,1993.0, nous relancerons les privatisations afin de désendetter la france et d'affecter les ressources nouvelles aux grands investissements publics,,Le Hénand,Loïc,Front national,non mentionné,Bexon,Stephan,Front national,non mentionné,False,True,Paris,far-right,0.0,0.0,0.0,0.0,3.0
644,645,EL195_L_1993_03_075_01_1_PF_06,1993.0, ministre brice lalonde a tout justifié: la loi hospitalière la loi besson sur les logements la loi jospin sur l'enseignement la loi quilès de privatisation des ptt maastricht la guerre du golfe etc,,Arnaudies,Dominique,Parti des travailleurs;Alliance européenne des travailleurs,non mentionné,Jeanne,Patrice,Parti des travailleurs;Alliance européenne des travailleurs,non mentionné,False,True,Paris,far-left,0.0,0.0,0.0,0.0,1.0
645,646,EL195_L_1993_03_075_01_1_PF_06,1993.0, 'nous vous invitons également à participer le 20 juin prochain à un rassemblement international contre les privatisations au zénith ou des délégations de 81 pays seront présentes,,Arnaudies,Dominique,Parti des travailleurs;Alliance européenne des travailleurs,non mentionné,Jeanne,Patrice,Parti des travailleurs;Alliance européenne des travailleurs,non mentionné,False,True,Paris,far-left,0.0,0.0,0.0,0.0,1.0
646,647,EL196_L_1993_03_077_05_1_PF_02,1993.0, mais le programme de la droite c'est toujours plus de cadeaux pour les privilégiés du capital et de la fortune et pour notre peuple toujours plus d'austérité avec des menaces contre le droit à la retraite complète à 60 ans contre les allocations familiales la privatisation et le démantèlement de grands services et entreprises publiques comme la s,,Jégo,Jean-Jacques,Parti communiste français,Rassemblement des forces de progrès,Bougault,Jakie,Parti communiste français,Rassemblement des forces de progrès,False,True,Seine-et-Marne,far-left,1.0,0.0,0.0,0.0,1.0
647,648,EL195_L_1993_03_071_01_1_PF_04,1993.0,' et toutes les réformes économiques à entreprendre doivent être inspirées de cette urgence : relance de la croissance plan logementbâtimenttravaux publics privatisations diminution des charges des entreprises encouragement à la création d'emplois fiscalité plus juste désendettement de l'etat revalorisation de l'enseignement technique et professionnel ,,Couturier,Roger,Rassemblement pour la République,Opposition unie,Tourny,Jacques,non mentionné,non mentionné,False,True,Saône-et-Loire,right,0.0,0.0,1.0,0.0,3.0
648,649,EL190_L_1993_03_017_02_1_PF_01,1993.0, elle a annoncé la couleur : menaces contre le droit à la retraite complète à 60 ans contre les allocations familiales privatisation et démantèlement de la sncf les p,,Guedon,Patrick,Parti communiste français,non mentionné,Grenier,Michelle,Parti communiste français,non mentionné,False,True,Charente-Maritime,far-left,1.0,0.0,0.0,0.0,1.0
649,650,EL195_L_1993_03_075_16_1_PF_03,1993.0, mais le programme de la droite c'est toujours plus de cadeaux pour les privilégiés du capital et de la fortune et pour notre peuple toujours plus d'austérité avec des menaces contre le droit à la retraite à 60 ans contre les allocations familiales la privatisation et le démantèlement de grands services et entreprises publiques comme la sncf la poste edf-gdf et même l'école publique sacrifiée pour instaurer une école à plusieurs vitesses suivant ses moyens financiers,,Malier,Catherine,Parti communiste français,non mentionné,Ponge,Thierry,Parti communiste français,non mentionné,False,True,Paris,far-left,1.0,0.0,0.0,0.0,1.0
650,651,EL197_L_1993_03_087_02_1_PF_06,1993.0, 'rien de bon à attendre de la droite' le programme de la droite c'est toujours plus de cadeaux pour les privilégiés du capital et de la fortune mais toujours plus d'austérité pour notre peuple avec des menaces contre le droit à la retraite complète à 60 ans contre les allocations familiales la privatisation et le démantèlement d'entreprises comme rvi de grands services publics : la sncf la poste edf-gdf l'équipement l'école ,,Ratier,Joël,Parti communiste français,non mentionné,Desroche,Jean-Claude,Parti communiste français,non mentionné,False,True,Haute-Vienne,far-left,1.0,0.0,0.0,0.0,1.0
651,652,EL194_L_1993_03_069_14_1_PF_10,1993.0, elle viendra de l'union des millions de travailleurs menacés par les plans de licenciements et de privatisations des millions de chômeurs et de travailleurs précaires de retraités de paysans de petits commerçants et d'artisans que condamnent la désertification rurale ,,Bony,Joëlle,Parti des travailleurs,non mentionné,Vassalo,François,Parti des travailleurs,non mentionné,False,True,Rhône,far-left,0.0,0.0,0.0,0.0,1.0
652,653,EL194_L_1993_03_069_14_1_PF_10,1993.0, 'oui la volonté et les forces existent pour réaliser l' unité contre le diktat des spéculateurs les privatisations les exigences de l'économie de marché qui entraîne toute la planète dans le chaos économique les guerres la misère qui détruisent la civilisation au nom du nouvel ordre mondial ' les grèves et les manifestations qui se multiplient contre les licenciements contre les fermetures de classes et le saccage de l'école contre les conséquences de la politique agricole commune en sont la preuve,,Bony,Joëlle,Parti des travailleurs,non mentionné,Vassalo,François,Parti des travailleurs,non mentionné,False,True,Rhône,far-left,0.0,0.0,0.0,0.0,1.0
653,654,EL194_L_1993_03_069_14_1_PF_10,1993.0, il appelle toutes celles et tous ceux qui se reconnaissent dans ce combat à se regrouper pour mener campagne pour l'unité pour s' organiser à soutenir et participer au rassemblement international contre les plans de privatisations destructions du fonds monétaire international qui aura lieu au zénith à paris le 20 juin 1993 'infotec 2000 paris' 'votez pour les candidats du parti des travailleurs ,,Bony,Joëlle,Parti des travailleurs,non mentionné,Vassalo,François,Parti des travailleurs,non mentionné,False,True,Rhône,far-left,0.0,0.0,0.0,0.0,1.0
654,655,EL198_L_1993_03_092_02_1_PF_10,1993.0, nous refusons absolument la dénationalisation de la banque de france et la privatisation ou le démantèlement des participations publiques stratégiques (edf postes sncf ,,Pirod,Guy,Nouvelle solidarité,non mentionné,Chauvier,Carmen,Nouvelle solidarité,non mentionné,False,True,Hauts-de-Seine,far-right,0.0,0.0,0.0,0.0,1.0
655,656,EL189_L_1993_03_006_01_1_PF_04,1993.0, privatisation réduction d'effectifs casse des statuts et conventions collectives attaques frontales contre la protection sociale et la retraite à 60 ans précarité de l'emploi ,,Caressa,Charles,Parti communiste français,non mentionné,Victor,Jacques,Parti communiste français,non mentionné,False,True,Alpes-Maritimes,far-left,1.0,0.0,0.0,0.0,1.0
656,657,EL192_L_1993_03_058_01_1_PF_06,1993.0, relancer l'économie c'est possible en diminuant les prélèvements obligatoires des entreprises en améliorant la formation professionnelle et en adoptant un véritable programme de privatisation,,Rostein,Daniel,Rassemblement pour la République;Union pour la démocratie française,non mentionné,Siri,Claude,Rassemblement pour la République;Union pour la démocratie française,non mentionné,False,True,Nièvre,right,0.0,0.0,1.0,1.0,3.0
657,658,EL189_L_1993_03_015_01_1_PF_01,1993.0, cette politique que vous rejettez la droite accompagnée par l'extrême droite et les écologistes veut l'aggraver : privatisations à outrance cadeaux accrus au grand patronat démantèlement de la protection sociale et de l'enseignement public partage du travail et des salaires ,,Cousin,Alain,non mentionné,Rassemblement pour se défendre et changer,Frescal,Jacques,non mentionné,Rassemblement pour se défendre et changer,False,True,Cantal,unaffiliated,0.0,0.0,0.0,0.0,1.0
658,659,EL194_L_1993_03_069_09_1_PF_06,1993.0, oui au plan de gauche d'un fonds de garantie de 100 milliards par vente de sociétés nationalisées dont l'utilité publique n'est pas évidente,,Rocher,Alain,non mentionné,Alliance des Français pour le progrès,Etienne,Jacques,non mentionné,Alliance des Français pour le progrès,True,False,Rhône,unaffiliated,0.0,0.0,0.0,0.0,2.0
659,660,EL195_L_1993_03_075_17_1_PF_03,1993.0, mais le programme de la droite c'est toujours plus de cadeaux pour les privilégiés du capital et de la fortune et pour notre peuple toujours plus d'austérité avec des menaces contre le droit à la retraite à 60 ans contre les allocations familiales la privatisation et le démantèlement de grands services et entreprises publiques comme la sncf la poste edf-gdf et même l'école publique sacrifiée pour instaurer une école à plusieurs vitesses suivant ses moyens financiers,,Dambreville,Dominique,Parti communiste français,non mentionné,Rizzi,Michel,Parti communiste français,non mentionné,False,True,Paris,far-left,1.0,0.0,0.0,0.0,1.0
660,661,EL197_L_1993_03_087_01_1_PF_04,1993.0, 'rien de bon à attendre de la droite' le programme de la droite c'est toujours plus de cadeaux pour les privilégiés du capital et de la fortune mais toujours plus d'austérité pour notre peuple avec des menaces contre le droit à la retraite complète à 60 ans contre les allocations familiales la privatisation et le démantèlement d'entreprises comme cogema simo rvi de grands services publics : la sncf la poste edf-gdf l'équipement l'école ,,Toulet,Claude,Parti communiste français,non mentionné,Paquet,Michel,Parti communiste français,non mentionné,False,True,Haute-Vienne,far-left,1.0,0.0,0.0,0.0,1.0
661,662,EL191_L_1993_03_038_03_2_PF_01,1993.0, la droite dans notre circonscription et en particulier à grenoble c'est : la privatisation du service des eaux de la ville de grenoble et la vente de grand'place 'la diminution des subventions aux associations' 'le désengagement de la ville dans le secteur social comme dans celui de la solidarité' l'aménagement des grands boulevards sans cesse reporté 'le laisser pour compte par la municipalité des quartiers sud de grenoble' l'augmentation des impôts locaux (+25%) 'une gestion de la ville dénoncée par la chambre régionale des comptes ,,Destot,Michel,Parti socialiste,Rassemblement de la gauche et des forces de progrès,Deschamps,Annie,Parti socialiste,Rassemblement de la gauche et des forces de progrès,False,True,Isère,left,0.0,1.0,0.0,0.0,1.0
662,663,EL189_L_1993_03_013_10_1_PF_09,1993.0,' 'non aux privatisations' 'on ferme les écoles on privatise les cantines scolaires on ferme la poste on liquide la santé publique tous les services publics au nom des impératifs de la rentabilité,,Sale,René,Parti des travailleurs,non mentionné,Boudrot,Charles,Parti des travailleurs,non mentionné,False,True,Bouches-du-Rhône,far-left,0.0,0.0,0.0,0.0,1.0
663,664,EL193_L_1993_03_061_03_1_PF_02,1993.0, relancer les privatisations pour financer une politique ambitieuse d'aménagement du territoire et d'infrastructures (autoroutes routes voies ferrées ,,Saint Quentin,Amaury de,Rassemblement pour la République,Opposition,Robert,Pierre,non mentionné,non mentionné,False,True,Orne,right,0.0,0.0,1.0,0.0,2.0
664,665,EL198_L_1993_03_094_09_1_PF_05,1993.0,300 francs par mois pour les nouveaux embauchés ; mise en cause de la retraite à soixante ans avec l'allongement de la durée des cotisations ; menaces directes sur l'hôpital public et sur l'école ; nouvelles augmentations des loyers avec la mainmise des promoteurs immobiliers sur les logements sociaux; difficultés accrues pour les salariés et les usagers des services publics qui seraient privatisés c'est à dire offerts à des sociétés dont le seul objectif est le profit,,Mercieca,Paul,Parti communiste français,non mentionné,Germa,Michel,Parti communiste français,non mentionné,False,True,Val-de-Marne,far-left,1.0,0.0,0.0,0.0,1.0
665,666,EL197_L_1993_03_090_02_2_PF_02,1993.0,' la perte de 1500 emplois en 5 plans sociaux à l'alsthom nationalisé entre 1981 et 1986,,Bichet,Jacques,non mentionné,Union pour la France,Courbey,Lionel,non mentionné,Union pour la France,True,False,Territoire-de-Belfort,unaffiliated,0.0,0.0,0.0,0.0,1.0
666,667,EL192_L_1993_03_048_01_1_PF_03,1993.0, 'nous voulons maintenir tout cela et par exemple créer un fond de garantie des retraites gagé sur les actifs des entreprises nationalisées,,Passebois,Etienne,Parti socialiste,non mentionné,Fabre,Etienne,Parti socialiste,non mentionné,True,False,Lozère,left,0.0,1.0,0.0,0.0,3.0
667,668,EL192_L_1993_03_055_02_1_PF_01,1993.0, mais le programme de la droite c'est toujours plus de cadeaux pour les privilégiés du capital et de la fortune et pour notre peuple toujours plus d'austérité avec des menaces contre le droit à la retraite complète à 60 ans contre les allocations familiales la privatisation et le démantèlement de grands services et entreprises publiques comme la s,,Mayer,Daniel,Parti communiste français,Rassemblement des forces de progrès,Lanini,Nello,Parti communiste français,Rassemblement des forces de progrès,False,True,Meuse,far-left,1.0,0.0,0.0,0.0,1.0
668,669,EL191_L_1993_03_038_05_1_PF_07,1993.0,' 'non aux privatisations' on ferme l'école on ferme la poste on liquide la santé publique tous les services publics au nom des impératifs de la rentabilité ,,non mentionné,non mentionné,Parti des travailleurs;Alliance européenne des travailleurs,non mentionné,non mentionné,non mentionné,Parti des travailleurs;Alliance européenne des travailleurs,non mentionné,False,True,Isère,far-left,0.0,0.0,0.0,0.0,1.0
